name,address,lng,lat,count
外滩,上海市黄浦区中山东一路北至外白渡桥、南至十六铺码头,121.497204,31.243453,481
豫园,上海市黄浦区福佑路168号,121.498732,31.232741,63
上海邮政博物馆,上海市虹口区天潼路395号2楼(近四川北路),121.491381,31.25014,48
中山公园,上海市长宁区长宁路780号,121.425343,31.228269,43
宋庆龄故居,上海市徐汇区淮海中路1843号,121.445316,31.210363,42
亭,上海市嘉定区宝安公路深城投十一街区,121.280658,31.33412,31
徐家汇公园,上海市徐汇区肇嘉浜路889号,121.448858,31.203746,23
西岸美术馆,上海市徐汇区龙腾大道2600号,121.470201,31.173712,22
马勒别墅,上海市松江区车墩镇北松公路4915号上海影视乐园内,121.318108,31.018107,21
穿越,上海市浦东新区永泰路659号,121.524218,31.145908,18
北外滩滨江绿地,上海市虹口区东大名路558-678,121.507602,31.253507,17
老街,上海市松江区车墩镇北松公路4915号上海影视乐园内,121.320901,31.017555,15
长廊,上海市闵行区昌林路上海浦江郊野公园,121.512702,31.066211,12
上海电影博物馆,上海市徐汇区漕溪北路595号,121.44453,31.192519,11
上海博物馆,上海市黄浦区人民大道201号,121.482126,31.23419,11
张乐平故居,上海市徐汇区五原路288弄3号,121.449749,31.218925,10
前滩休闲公园,前滩大道与园照路交叉口西北100米,121.474496,31.158208,10
天主堂,上海市嘉定区联星村154号,121.273124,31.272525,8
闵行博物馆,上海市闵行区新镇路1538号,121.365556,31.166596,8
滑板公园,上海市闵行区新龙路1285号,121.344402,31.158462,8
世博会博物馆,上海市黄浦区蒙自路818号,121.488517,31.200168,8
震旦博物馆,上海市浦东新区富城路99号震旦国际大楼1层,121.506116,31.240502,8
东岸绿道,上海市浦东新区东岸绿道中国远洋海运大厦西侧约50米,121.516224,31.214386,7
世纪公园,上海市浦东新区锦绣路1001号,121.558979,31.222046,6
龙华寺,上海市徐汇区龙华镇龙华路2853号,121.458265,31.181637,6
长风公园,上海市普陀区大渡河路189号,121.403703,31.230279,6
滨江步道,上海市浦东新区泳耀路与耀体路交叉口西北前滩友城公园内,121.477484,31.162467,6
彩虹桥,上海市闵行区申昆路291号华翔绿地公园(东南角),121.336333,31.177414,6
土山湾博物馆,上海市徐汇区蒲汇塘路55号,121.441491,31.192968,6
彩虹桥,上海市徐汇区龙吴路1111号(近百色路)上海植物园内,121.455399,31.154309,6
凝,上海市闵行区柳鹭田园区游客驿站北,121.511086,31.055795,5
鲁迅公园,上海市虹口区四川北路2288号,121.490155,31.277476,5
浙江路桥,上海市松江区车墩镇北松公路4915号上海影视乐园内,121.320427,31.017421,5
中华艺术宫,上海市浦东新区上南路205号,121.501315,31.190005,5
世博公园,上海市浦东新区世博大道1750号,121.491182,31.1929,5
三一堂,上海市浦东新区浦星公路290号,121.501182,31.132233,5
田园,上海市闵行区梅州路445号,121.401887,31.092918,4
白莲泾桥,上海市浦东新区白莲泾与浦东滨江交汇处;上海市浦东新区一号运动中心向东约100米处,121.507913,31.200889,4
徐汇滨江绿地,上海市徐汇区东安路与龙腾大道交叉口东,121.470436,31.187552,4
杨浦滨江,上海市杨浦区杨树浦路2086号,121.552402,31.269178,4
人民公园,上海市黄浦区南京西路231号,121.479656,31.238252,4
游乐场,上海市闵行区闵行公园内,121.432207,31.015017,4
上海自然博物馆,上海市静安区北京西路510号(静安雕塑公园内),121.469147,31.241162,4
上海公安博物馆,上海市徐汇区瑞金南路518号(近打浦桥),121.474896,31.20445,3
上海城隍庙,上海市黄浦区方浜中路249号,121.499034,31.231471,3
观复博物馆,上海市浦东新区陆家嘴环路479号上海中心大厦第37楼,121.512317,31.239252,3
静安公园,上海市静安区南京西路1649号,121.453099,31.228471,3
古城公园,上海市黄浦区人民路333号,121.500454,31.234126,3
光启公园,上海市徐汇区南丹路17号近汇站路,121.441044,31.195968,3
海事塔,上海市徐汇区龙华街道龙腾大道3036号,121.46886,31.183655,3
上海植物园,上海市徐汇区龙吴路1111号,121.45099,31.153891,3
玫瑰园,上海市松江区辰花路388号青青旅游世界内,121.260729,31.07812,3
前滩体育公园,上海市浦东新区前滩大道735号,121.470393,31.153059,2
七宝古镇,上海市闵行区青年路与横沥路交叉口,121.361199,31.158938,2
锦江乐园,上海市闵行区虹梅路201号,121.415479,31.145542,2
闵行文化公园,上海市闵行区吴中路2019号,121.362762,31.173791,2
宝龙美术馆,上海市闵行区漕宝路3055弄,121.364363,31.164081,2
上海当代艺术博物馆,上海市黄浦区苗江路678号,121.505082,31.206746,2
北外滩国客中心,上海市虹口区东大名路500号,121.507258,31.253268,2
荷花池,上海市普陀区大渡河路451号长风公园内,121.404867,31.232876,2
荷花池,上海市闵行区莘浜路421号莘庄公园,121.381406,31.10817,2
荷花池,上海市闵行区贡山路吴泾公园(氯碱小区东北侧约100米),121.483613,31.052117,2
1933老场坊,上海市虹口区溧阳路611号,121.49833,31.260148,2
儿童游乐场,上海市闵行区新港河路与永颂路交叉口东150米,121.509408,31.03137,2
陆家嘴中心绿地,上海市浦东新区陆家嘴环路717号,121.512991,31.243648,2
醉白池公园,上海市松江区人民南路64号,121.237516,31.00776,2
徐家汇源,上海市徐汇区蒲西路166-1号,121.442952,31.197389,2
徐光启墓,上海市徐汇区南丹路17-1号临,121.441192,31.196073,2
儿童游乐场,上海市徐汇区肇嘉浜路986号徐家汇公园内,121.449115,31.20364,2
南翔古镇,上海市嘉定区解放街206号,121.314913,31.296924,1
上海木文化博物馆,上海市宝山区沪太路2751号,121.418427,31.316102,1
东方明珠广播电视塔,上海市浦东新区世纪大道1号,121.506379,31.245414,1
顾正红纪念馆,上海市普陀区澳门路300号,121.448945,31.253441,1
上海国际时尚中心,上海市杨浦区杨树浦路2866号,121.564765,31.276993,1
顾村公园,上海市宝山区顾村镇沪太路4788号,121.376489,31.34461,1
月季园,上海市宝山区顾村镇沪太路4788号顾村公园内,121.36844,31.342562,1
鲁迅墓,上海市虹口区四川北路2288号鲁迅公园内,121.489253,31.27791,1
瞿秋白故居,上海市虹口区山阴路一三三弄12号,121.491437,31.27185,1
复兴岛公园,上海市杨浦区共青路386号,121.568112,31.292898,1
电动滑道,上海市杨浦区军工路2000号共青森林公园内,121.553599,31.326091,1
鲁迅纪念馆,上海市虹口区甜爱路200号,121.490442,31.275505,1
海战船,上海市杨浦区军工路2000号共青森林公园内,121.558145,31.328731,1
上海犹太难民纪念馆,上海市虹口区长阳路62号,121.515776,31.259707,1
梅园,上海市宝山区泮池北路上海大学(宝山校区),121.397546,31.323284,1
湿地,上海市静安区广中西路288号大宁灵石公园内,121.449666,31.281721,1
黄兴公园,上海市杨浦区营口路639号,121.536425,31.299442,1
建筑模型博物馆,上海市静安区江场三路191号风语筑设计大楼9楼,121.44508,31.299959,1
基督教堂,上海市宝山区真北路3777弄337号,121.408337,31.292494,1
东方渔人码头,上海市杨浦区杨树浦路1088号,121.538842,31.257801,1
古树公园,上海市嘉定区安亭镇光明村泰海路230号,121.25151,31.32131,1
霍山公园,上海市虹口区霍山路118号(近舟山路),121.517695,31.259124,1
南园滨江绿地,上海市黄浦区龙华东路800号,121.48194,31.198223,1
梅园,上海市闵行区纪高路与纪前路交叉路口往东北约170米,121.284073,31.247728,1
世纪春沁园,上海市浦东新区锦绣路1001号世纪公园内,121.56477,31.226339,1
东安公园,上海市徐汇区中山南二路811号,121.460767,31.191483,1
龙华烈士陵园,上海市徐汇区龙华西路180号,121.455712,31.181942,1
桂林公园,上海市徐汇区桂林路128号近地铁12号线桂林公园站,121.424372,31.171505,1
上海动物园,上海市长宁区虹桥路2381号,121.369284,31.199023,1
前滩友城公园,泳耀路与耀体路交叉口西北,121.478472,31.163146,1
闵行体育公园,上海市闵行区新镇路456号,121.377542,31.149117,1
梅园,上海市浦东新区三航路与新梅路交叉路口往东北约130米,121.487647,31.140099,1
梅园,上海市闵行区陈行公路与苏近路交叉路口往南约70米,121.536809,31.117641,1
云堡未来市,上海市松江区洞泾镇王家厍路885号,121.238394,31.095799,1
月季园,上海市松江区华军路一区1号,121.269536,31.052099,1
上海影视乐园,上海市松江区车墩镇车亭公路211号,121.318804,31.016708,1
梅园公园,上海市浦东新区乳山路180号,121.533084,31.242314,1
静安雕塑公园,上海市静安区石门二路128号(近北京西路),121.47046,31.240967,1
上海纺织博物馆,上海市普陀区澳门路128~150号纺博大厦3层,121.452389,31.253111,1
上海凝聚力工程博物馆,上海市长宁区长宁路878号,121.425773,31.226569,1
威尼斯小镇,上海市普陀区金沙江路1685号118广场F1,121.384226,31.236542,1
刘海粟美术馆,上海市长宁区延安西路1609号,121.426009,31.215754,1
风荷桥,上海市浦东新区世纪公园,121.561567,31.222057,1
太平桥公园,自忠路170号,121.483818,31.225334,1
上海孙中山故居纪念馆,上海市黄浦区香山路7号,121.474366,31.222134,1
襄阳公园,上海市徐汇区淮海中路1008号(近襄阳北路),121.463193,31.223319,1
愚园路历史名人墙,上海市长宁区江苏路街道愚园路1065号,121.435468,31.224916,1
钱学森旧居,上海市长宁区愚园路一〇三二弄111号,121.435598,31.226383,1
安流桥,上海市浦东新区花木路世纪公园,121.562902,31.219385,1
琴键春园,上海市黄浦区苗江路200号,121.502829,31.202405,1
